{
  "schema_version": 2,
  "id": "dfb-taint-python-model-store-roundtrip-positive",
  "template_id": "dfb-template-model-store-roundtrip",
  "polarity": "positive",
  "score_tier": "modeling",
  "track": "taint",
  "language": "python",
  "semantic_dimensions": [
    "interprocedural-flow",
    "heap-field-sensitivity"
  ],
  "feature_tags": [
    "modeled-external",
    "heap-access-path"
  ],
  "model_profile": "benchmark-controlled",
  "fixture_files": [
    "store.py"
  ],
  "source_anchors": [
    {
      "marker": "DFB-SOURCE: model-store-roundtrip-input",
      "file": "store.py",
      "line_hint": 11
    }
  ],
  "sink_anchors": [
    {
      "marker": "DFB-SINK: model-store-roundtrip-sink",
      "file": "store.py",
      "line_hint": 15
    }
  ],
  "expected_flows": [
    {
      "source": "DFB-SOURCE: model-store-roundtrip-input",
      "sink": "DFB-SINK: model-store-roundtrip-sink"
    }
  ],
  "expected_nonflows": [],
  "witness_checkpoints": [
    "DFB-SOURCE: model-store-roundtrip-input",
    "DFB-SINK: model-store-roundtrip-sink"
  ],
  "expected_analysis_capability": {
    "kind": "persistence-boundary-activation"
  },
  "execution_budget": {
    "wall_clock_seconds": 60,
    "peak_memory_mb": 512
  },
  "fixture_provenance": {
    "kind": "authored",
    "origin": "DataFlowBench",
    "revision": "m3-modeling-python",
    "license": "MIT"
  },
  "tool_model_references": {
    "bifrost": {
      "policy": "adapters/bifrost/policies/model-python.rqlp"
    },
    "codeql": {
      "query": "adapters/codeql/python/queries/PythonModeling.ql"
    }
  }
}
