{
  "schema_version": 2,
  "id": "dfb-taint-swift-recursive-payload-transform-positive",
  "template_id": "dfb-template-chal-recursive-payload-transform",
  "polarity": "positive",
  "score_tier": "core",
  "track": "taint",
  "language": "swift",
  "semantic_dimensions": [
    "recursion",
    "interprocedural-flow",
    "flow-sensitivity"
  ],
  "feature_tags": [
    "recursive"
  ],
  "model_profile": "benchmark-controlled",
  "fixture_files": [
    "main.swift"
  ],
  "source_anchors": [
    {
      "marker": "DFB-SOURCE: recursive-payload-transform-input",
      "file": "main.swift",
      "line_hint": 13
    }
  ],
  "sink_anchors": [
    {
      "marker": "DFB-SINK: recursive-payload-transform-sink",
      "file": "main.swift",
      "line_hint": 14
    }
  ],
  "expected_flows": [
    {
      "source": "DFB-SOURCE: recursive-payload-transform-input",
      "sink": "DFB-SINK: recursive-payload-transform-sink"
    }
  ],
  "expected_nonflows": [],
  "witness_checkpoints": [
    "DFB-WITNESS: recursive-payload-transform-base",
    "DFB-WITNESS: recursive-payload-transform-recursive-transfer",
    "DFB-WITNESS: recursive-payload-transform-compose",
    "DFB-SOURCE: recursive-payload-transform-input",
    "DFB-SINK: recursive-payload-transform-sink"
  ],
  "expected_analysis_capability": {
    "kind": "recursive-payload-transform-taint"
  },
  "execution_budget": {
    "wall_clock_seconds": 60,
    "peak_memory_mb": 512
  },
  "fixture_provenance": {
    "kind": "authored",
    "origin": "DataFlowBench",
    "revision": "swift-fixtures-217",
    "license": "MIT"
  },
  "tool_model_references": {}
}
