{
  "schema_version": 2,
  "id": "dfb-taint-javascript-native-source-sink-positive",
  "template_id": "dfb-template-native-source-sink",
  "polarity": "positive",
  "score_tier": "modeling",
  "track": "taint",
  "language": "javascript",
  "semantic_dimensions": [
    "local-flow"
  ],
  "feature_tags": [
    "modeled-external"
  ],
  "model_profile": "tool-native",
  "fixture_files": [
    "probe.js"
  ],
  "source_anchors": [
    {
      "marker": "DFB-SOURCE: native-source-sink-input",
      "file": "probe.js",
      "line_hint": 4
    }
  ],
  "sink_anchors": [
    {
      "marker": "DFB-SINK: native-source-sink-sink",
      "file": "probe.js",
      "line_hint": 5
    }
  ],
  "expected_flows": [
    {
      "source": "DFB-SOURCE: native-source-sink-input",
      "sink": "DFB-SINK: native-source-sink-sink"
    }
  ],
  "expected_nonflows": [],
  "witness_checkpoints": [],
  "expected_analysis_capability": {
    "kind": "native-source-sink-coverage"
  },
  "execution_budget": {
    "wall_clock_seconds": 60,
    "peak_memory_mb": 512
  },
  "fixture_provenance": {
    "kind": "authored",
    "origin": "DataFlowBench",
    "revision": "n1-native-javascript",
    "license": "MIT"
  },
  "tool_model_references": {}
}
