{
  "schema_version": 2,
  "id": "dfb-taint-java-model-opaque-propagator-positive",
  "template_id": "dfb-template-model-opaque-propagator",
  "polarity": "positive",
  "score_tier": "modeling",
  "track": "taint",
  "language": "java",
  "semantic_dimensions": [
    "interprocedural-flow"
  ],
  "feature_tags": [
    "modeled-external",
    "summary-required"
  ],
  "model_profile": "benchmark-controlled",
  "fixture_files": [
    "ModelOpaquePropagatorPositive.java"
  ],
  "source_anchors": [
    {
      "marker": "DFB-SOURCE: model-opaque-propagator-input",
      "file": "ModelOpaquePropagatorPositive.java",
      "line_hint": 30
    }
  ],
  "sink_anchors": [
    {
      "marker": "DFB-SINK: model-opaque-propagator-sink",
      "file": "ModelOpaquePropagatorPositive.java",
      "line_hint": 34
    }
  ],
  "expected_flows": [
    {
      "source": "DFB-SOURCE: model-opaque-propagator-input",
      "sink": "DFB-SINK: model-opaque-propagator-sink"
    }
  ],
  "expected_nonflows": [],
  "witness_checkpoints": [],
  "expected_analysis_capability": {
    "kind": "opaque-propagator-activation"
  },
  "execution_budget": {
    "wall_clock_seconds": 60,
    "peak_memory_mb": 512
  },
  "fixture_provenance": {
    "kind": "authored",
    "origin": "DataFlowBench",
    "revision": "m3-modeling-java",
    "license": "MIT"
  },
  "tool_model_references": {
    "bifrost": {
      "policy": "adapters/bifrost/policies/model-java.rqlp"
    },
    "codeql": {
      "query": "adapters/codeql/queries/JavaModeling.ql"
    }
  }
}
