{
  "schema_version": 2,
  "id": "dfb-taint-java-native-summary-positive",
  "template_id": "dfb-template-native-summary",
  "polarity": "positive",
  "score_tier": "modeling",
  "track": "taint",
  "language": "java",
  "semantic_dimensions": [
    "local-flow",
    "external-summary"
  ],
  "feature_tags": [
    "modeled-external",
    "intraprocedural",
    "summary-required"
  ],
  "model_profile": "tool-native",
  "fixture_files": [
    "NativeSummaryPositive.java"
  ],
  "source_anchors": [
    {
      "marker": "DFB-SOURCE: native-summary-env",
      "file": "NativeSummaryPositive.java",
      "line_hint": 18
    }
  ],
  "sink_anchors": [
    {
      "marker": "DFB-SINK: native-summary-exec",
      "file": "NativeSummaryPositive.java",
      "line_hint": 21
    }
  ],
  "expected_flows": [
    {
      "source": "DFB-SOURCE: native-summary-env",
      "sink": "DFB-SINK: native-summary-exec"
    }
  ],
  "expected_nonflows": [],
  "witness_checkpoints": [],
  "expected_analysis_capability": {
    "kind": "native-summary-coverage",
    "notes": "A catalog that models neither half of a Base64 round trip loses the flow at the first call; codeql/java-all ships both halves."
  },
  "execution_budget": {
    "wall_clock_seconds": 300,
    "peak_memory_mb": 4096
  },
  "fixture_provenance": {
    "kind": "authored",
    "origin": "DataFlowBench",
    "revision": "n1-native-java",
    "license": "MIT"
  },
  "tool_model_references": {}
}
