{
  "schema_version": 2,
  "id": "dfb-taint-javascript-model-declared-sink-positive",
  "template_id": "dfb-template-model-declared-sink",
  "polarity": "positive",
  "score_tier": "modeling",
  "track": "taint",
  "language": "javascript",
  "semantic_dimensions": [
    "local-flow"
  ],
  "feature_tags": [
    "modeled-external",
    "interprocedural-one-hop"
  ],
  "model_profile": "benchmark-controlled",
  "fixture_files": [
    "Audit.js"
  ],
  "source_anchors": [
    {
      "marker": "DFB-SOURCE: model-declared-sink-input",
      "file": "Audit.js",
      "line_hint": 1
    }
  ],
  "sink_anchors": [
    {
      "marker": "DFB-SINK: model-declared-sink-sink",
      "file": "Audit.js",
      "line_hint": 6
    }
  ],
  "expected_flows": [
    {
      "source": "DFB-SOURCE: model-declared-sink-input",
      "sink": "DFB-SINK: model-declared-sink-sink"
    }
  ],
  "expected_nonflows": [],
  "witness_checkpoints": [],
  "expected_analysis_capability": {
    "kind": "declared-sink-activation"
  },
  "execution_budget": {
    "wall_clock_seconds": 60,
    "peak_memory_mb": 512
  },
  "fixture_provenance": {
    "kind": "authored",
    "origin": "DataFlowBench",
    "revision": "m3-modeling-javascript",
    "license": "MIT"
  },
  "tool_model_references": {
    "bifrost": {
      "policy": "adapters/bifrost/policies/model-javascript.rqlp"
    },
    "codeql": {
      "query": "adapters/codeql/javascript/queries/JavaScriptModeling.ql"
    }
  }
}
