{
  "schema_version": 2,
  "id": "dfb-taint-csharp-expression-positive",
  "template_id": "dfb-template-arithmetic-expression-propagation",
  "polarity": "positive",
  "score_tier": "core",
  "track": "taint",
  "language": "csharp",
  "semantic_dimensions": [
    "local-flow"
  ],
  "feature_tags": [
    "intraprocedural"
  ],
  "model_profile": "benchmark-controlled",
  "fixture_files": [
    "ExpressionPositive.cs"
  ],
  "source_anchors": [
    {
      "marker": "DFB-SOURCE: expression-input",
      "file": "ExpressionPositive.cs"
    }
  ],
  "sink_anchors": [
    {
      "marker": "DFB-SINK: expression-sink",
      "file": "ExpressionPositive.cs"
    }
  ],
  "expected_flows": [
    {
      "source": "DFB-SOURCE: expression-input",
      "sink": "DFB-SINK: expression-sink"
    }
  ],
  "expected_nonflows": [],
  "witness_checkpoints": [
    "DFB-SOURCE: expression-input",
    "DFB-WITNESS: expression-computed",
    "DFB-SINK: expression-sink"
  ],
  "expected_analysis_capability": {
    "kind": "expression-propagating-intraprocedural-taint"
  },
  "execution_budget": {
    "wall_clock_seconds": 60,
    "peak_memory_mb": 512
  },
  "fixture_provenance": {
    "kind": "authored",
    "origin": "DataFlowBench",
    "revision": "m2-csharp-kernel",
    "license": "MIT"
  },
  "tool_model_references": {
    "bifrost": {
      "policy": "adapters/bifrost/policies/core-csharp-kernel.rqlp"
    },
    "codeql": {
      "query": "adapters/codeql/csharp/queries/CSharpKernel.ql"
    }
  }
}
