{
  "schema_version": 2,
  "id": "dfb-taint-csharp-recursive-heap-unwind-positive",
  "template_id": "dfb-template-chal-recursive-heap-unwind",
  "polarity": "positive",
  "score_tier": "core",
  "track": "taint",
  "language": "csharp",
  "semantic_dimensions": ["recursion", "interprocedural-flow", "flow-sensitivity", "heap-field-sensitivity"],
  "feature_tags": ["recursive", "heap-access-path"],
  "model_profile": "benchmark-controlled",
  "fixture_files": ["RecursiveHeapUnwindPositive.cs"],
  "source_anchors": [{
    "marker": "DFB-SOURCE: recursive-heap-unwind-input",
    "file": "RecursiveHeapUnwindPositive.cs",
    "line_hint": 10
  }],
  "sink_anchors": [{
    "marker": "DFB-SINK: recursive-heap-unwind-sink",
    "file": "RecursiveHeapUnwindPositive.cs",
    "line_hint": 15
  }],
  "expected_flows": [{
    "source": "DFB-SOURCE: recursive-heap-unwind-input",
    "sink": "DFB-SINK: recursive-heap-unwind-sink"
  }],
  "expected_nonflows": [],
  "witness_checkpoints": [
    "DFB-SOURCE: recursive-heap-unwind-input",
    "DFB-WITNESS: recursive-heap-unwind-transfer",
    "DFB-WITNESS: recursive-heap-unwind-base",
    "DFB-WITNESS: recursive-heap-unwind-compose",
    "DFB-SINK: recursive-heap-unwind-sink"
  ],
  "expected_analysis_capability": {"kind": "recursive-heap-unwind-taint"},
  "execution_budget": {"wall_clock_seconds": 60, "peak_memory_mb": 512},
  "fixture_provenance": {
    "kind": "authored",
    "origin": "DataFlowBench",
    "revision": "m4-recursive-composition-csharp",
    "license": "MIT"
  },
  "tool_model_references": {
    "bifrost": {"policy": "adapters/bifrost/policies/core-csharp-kernel.rqlp"},
    "codeql": {"query": "adapters/codeql/csharp/queries/CSharpKernel.ql"}
  }
}
